{
  "manifest_format": 1,
  "run_id": "run_example",
  "created_at": "2026-09-21T14:13:20Z",
  "contract": {
    "schema_name": "breeding-literature-record",
    "schema_version": "3.6.0",
    "release_status": "released",
    "requested": "3.6.0",
    "release_sha256": "e51608a630182e973ea0b0607b833c3bd8bc8d173be1fbb947e962ee7ac9d906",
    "source_digest": "e3c5edb64a249ab758fdb9c5314ae6a0931b438dcc13a3bc7cfbd9d3d1058215"
  },
  "profile": {
    "name": "pdf_extraction",
    "extends_chain": [
      "pdf_extraction"
    ],
    "fill_rules": [
      "backend_confidence",
      "backend_extraction_method",
      "candidate_record_kind",
      "cli_option",
      "constant",
      "document_source_id",
      "doi_uri",
      "evidence_locator",
      "evidence_source_part",
      "evidence_span",
      "grain_from_record_kind",
      "input_asset_manifest",
      "input_file_sha256",
      "input_file_size",
      "missing_audit",
      "profile_name",
      "qc_rule_set_version",
      "relation_anchors",
      "relation_nature_from_predicate",
      "resolved_schema_name",
      "resolved_schema_version",
      "run_id",
      "stable_record_id",
      "unit_normalization",
      "validation_outcome",
      "warning_codes"
    ],
    "field_count": 233
  },
  "input": {
    "file_name": "synthetic_rice_qtl.pdf",
    "sha256": "73754bef99491d4c01763d1f5d54bf3143edbf61652eb8bfbb959da4335a4819",
    "size_bytes": 3131,
    "media_type": "application/pdf",
    "page_count": 3,
    "parser": {
      "name": "pypdf",
      "version": "6.19.0"
    },
    "candidates_sha256": "b0602804db9d8b386f31629e2609ba3c75d1a964202555d4e18ce69d2cf3ecca"
  },
  "pipeline": {
    "name": "pdf2jsonl",
    "version": "0.4.0",
    "contract_tooling": "1.0.0"
  },
  "backend": {
    "name": "candidates",
    "extraction_method": "model",
    "model": "example-agent"
  },
  "options": {},
  "environment": {
    "python": "3.10.12",
    "platform": "Linux-6.8.0-94-generic-x86_64-with-glibc2.35",
    "packages": {
      "jsonschema": "4.26.0",
      "PyYAML": "6.0.3",
      "pypdf": "6.19.0"
    }
  },
  "counts": {
    "pages": 3,
    "candidates": 18,
    "records": 18,
    "rejected": 1
  },
  "outputs": {
    "records": {
      "file": "synthetic_rice_qtl.jsonl",
      "sha256": "9a380f5c4287a0cc80555502d9f63df7c5b8a2db80ebb27c74ba82d75eb01f5f"
    },
    "errors": {
      "file": "synthetic_rice_qtl.errors.jsonl",
      "sha256": "717fb6f24a3588b7bc431690958fe0cbfdd3f7cc11ad0b7b840cc22a4148a45a"
    },
    "validation": {
      "file": "synthetic_rice_qtl.validation.json",
      "sha256": "3b4dd8f7ee202ab45abf4befed2a8185e039498ecc359914cbb7a0944d4f48d4"
    },
    "bundle": {
      "file": "synthetic_rice_qtl.bundle.json",
      "sha256": "7facea07adb26d0588f292ff24c23aaa75bda009f7250e6654eb1011263ab3e9"
    }
  },
  "source_parts": {
    "missing": [],
    "complete": true
  }
}
